{
  "status": "completed",
  "result_type": "document_draft",
  "artifacts": [
    {
      "type": "strategy_memo_draft",
      "title": "Strategy Memo Draft",
      "location": "inline://strategy-memo-draft"
    }
  ],
  "summary": "Generated a concise review-ready strategy memo draft from the provided interview notes, organized into executive summary, key themes, risks, and recommended next steps.",
  "open_questions": [
    "Is there a preferred internal memo template to apply?",
    "Should the draft be shortened further for executive circulation?"
  ],
  "assumptions_used": [
    "Assumed the audience is an internal leadership team",
    "Assumed a generic strategy memo structure is acceptable in the absence of a company-specific template"
  ],
  "approval_pending": false,
  "next_recommended_action": "Review the draft, confirm preferred format and length, then optionally convert it into slides or an external-facing summary"
}